{
  "schema_version": "0.1.0",
  "artifact_type": "feature-opportunity",
  "status": "draft",
  "opportunity_set_id": "FO-EXAMPLE-0001",
  "scope": {
    "segment_id": "SEG-EXAMPLE",
    "region_id": "REG-US",
    "timeWindow": "2026H1"
  },
  "opportunities": [
    {
      "featureLabel": "Simplified serviceability",
      "description": "example placeholder",
      "mapped_pain_points": ["Operational complexity"],
      "expected_value": "medium",
      "feasibility": "medium",
      "time_horizon": "mid",
      "design_traits": ["example placeholder"],
      "risks": ["example placeholder"],
      "evidence_refs": ["EVID-EXAMPLE-0001"]
    }
  ],
  "evidence_refs": ["EVID-EXAMPLE-0001"],
  "unresolved_items": ["Replace placeholders with Tier 1\u20134 evidence bundles."],
  "primary_model_origin": "chatgpt-plus",
  "supporting_model_origins": [],
  "model_stage_contributions": [
    {
      "stage": "normalization",
      "model_origin": "chatgpt-plus",
      "notes": "Initial example artifact construction."
    }
  ]
}
